product_name,product_description,product_image,product_price
Dragon's Dream Nest,Your dragon deserves a perch like no other. Gift them our luxurious Dream Nest designed for opulent comfort. This bed is a rejuvenating sanctuary.,/images/product17.png,5530
SkySway Dragon Hammock,Let your dragon feel as if they're floating amidst the clouds with our SkySway Hammock. Built for the majesty of dragons it offers airborne relaxation like none other.,/images/product8.png,2990
Draconic Drift Lounger,Bestow upon your dragon the enchantment of airborne slumber with the Draconic Drift. This luxury hammock is fit for royal dragons.,/images/product12.png,6000
SerpentSling Relaxer,The SerpentSling with its sturdy design strikes the ideal balance between comfort and stability. It's a place for dragons to dream and sway above it all.,/images/product6.png,3990
Mystic Breeze Bedswing,The Mystic Breeze enhanced with enchantments offers not just comfort but also luxury. It's more than a hammock; it's a symbol of prestige for your cherished dragon.,/images/product5.png,5690
Celestial CloudCradle,The CloudCradle replicates the soothing hold of clouds ensuring your dragon's security and relaxation as they float high above.,/images/product4.png,2550
Sandy Serpent ShoreBed,Let your dragon experience the magic of mystical beaches with this bed made of fine golden sands. It contours perfectly to their form offering an unmatched coastal comfort.,/images/product1.png,5200
Azure Wave Waterbed,Experience the peace of the ocean with this waterbed. It captures the gentle sea waves offering your dragon a tranquil rest.,/images/product11.png,4500
Forest Flight Nest,This nest seamlessly fuses woodland beauty and coziness. Made of pine needles moss and ferns it's perfect for dragons that cherish nature's embrace.,/images/product3.png,4890
Starry Slumber Sleeper,For the adventurous dragons this bed adorned with luminescent stars promises a magical night sky ensuring they always dream big.,/images/product2.png,4020
Luminous EmberNest,Discover the Luminous EmberNest combining style and utility for your petite dragon. Its vibrant contrast and attached lamp illuminates their space adding magic to nighttime routines.,/images/product13.png,4480
Azure Drift CaveBed with Dragon Buddy,Introducing the Azure Drift CaveBed combining comfort with playful design. With its cloud-like sanctuary and a cozy cave design it also comes with a dragon companion for company.,/images/product16.png,4935
Mystic Meadow AirNest,The Mystic Meadow AirNest is where forest charm meets modern luxury. With an elevated air mattress and forest canopy your dragon will feel nature's touch.,/images/product10.png,3820
Celestial Roost Retreat,Merge nature's luxury with our Celestial Roost Retreat. Soft leaves combined with plush feathers make it a haven for your dragon against a backdrop of serene blue.,/images/product14.png,5280
SleekDream SlumberPad,Meet the SleekDream SlumberPad crafted for your dragon's elegance. Balancing comfort with sleekness it's versatile enough to fit any space radiating grace and coziness.,/images/product15.png,4760
Desert Dreamer HeatNest,Welcome to the Desert Dreamer HeatNest the ultimate haven for petite dragons. Its warm design captures the desert's charm ensuring they always stay cozy.,/images/product7.png,2140
Quilted CozySpiral Nest,Revealing the Quilted CozySpiral Nest it's all about design and comfort. Tiered steps let your dragon wind down softly making it perfect for those that love to coil and relax.,/images/product9.png,5830
